Date,Tweet_ID,Username,Raw Text,Likes,Retweets,is_fire,is_forest,is_urban
Mon Aug 12 21:45:47 +0000 2024,1823113677471449178,enikos.gr,Φωτιά στην Αττική: Μάχη με τις διάσπαρτες εστίες και τις συνεχείς αναζωπυρώσεις – Το σχέδιο της Πυροσβεστικής και οι προβλέψεις των μετεωρολόγων για την ένταση των ανέμων https://t.co/PZqI7XwOIl,2,1,,,
Mon Aug 12 21:44:54 +0000 2024,1823113458495221826,greekcardscollector,@KatherineKont Με ρέγουλο οι ασυναρτησίες... την ώρα που καίγεται η χώρα έχουμε και εσάς με αρνητικό iq,3,0,,,
Mon Aug 12 21:44:47 +0000 2024,1823113427058872694,👉🏼Αβάφτιστη η Ευρωπαία👈🏼,Μπορεί κάποιος να με ενημερώσει ως προς την ενίσχυση που έχει λάβει η πυροσβεστική σε οχήματα και έμψυχο δυναμικό τα τελευταία χρόνια;  #φωτια,3,0,,,
Mon Aug 12 21:44:29 +0000 2024,1823113350080778330,Ο Μπίρλας κι ο Κόρκος,Στη Νέα Μάκρη παίζει Φωτιά στο λιμάνι,5,2,,,
Mon Aug 12 21:44:21 +0000 2024,1823113319143628866,Protothema.gr,Φωτιά στην Τερψιθέα Γλυφάδας: Θέμα χρόνου η σύλληψη των δύο εμπρηστών λέει ο δήμαρχος https://t.co/qSVh30ZCvL https://t.co/L4JvUO7P3O,3,1,,,
Mon Aug 12 21:44:16 +0000 2024,1823113296926416930,Πάνος Συνοδινός,"@CucuvaYia Κι εγω θελω να τον βρίζω καθε μερα, αλλα την ωρα που καίγεται το σπίτι μου θα κοιτούσα να τον σώσω, οχι να βρίζω άλλους.",1,0,,,
Mon Aug 12 21:44:05 +0000 2024,1823113251749507398,αμπαλεαδόρ,"Είναι γνωστό το αφηγημα κάθε χρόνο.  Μας καίνε αριστεροί , κομμουνιστές και κάθε λογής αντιΜητσοτακιστές σε συνεργασία με ξένους πράκτορες και Ισλαμιστές μετανάστες.  #φωτια #φωτιες #Φωτια_τωρα #φωτια_πεντελη #φωτιά",4,1,,,
Mon Aug 12 21:43:59 +0000 2024,1823113224474280216,(Je μ'αpp εlle) Πλού,@paliopaido_egw Στο στρατόπεδο λες; Πως πήρε φωτιά αυτό; Δεν βρήκα κάτι.,1,0,,,
Mon Aug 12 21:43:36 +0000 2024,1823113130861601003,Vera J. Frantzi,Εποχικοί πυροσβέστες κάποιους απο τους ήρωες.  Εξοργιστικό.  #φωτια #φωτια_πεντελη #Φωτια_τωρα #φωτιες #πυρκαγιας #πυρκαγιά,4,0,,,
Mon Aug 12 21:43:31 +0000 2024,1823113109005091098,Μπεν Σαλαμούρας,@mgrigorakis Για την μόνη φωτιά που ευθύνεται ο Μητσιτακης είναι που από την λύσσα σας εναντίον του  έχετε κάψει τις φράντζες του μυαλού σας,0,0,,,
Mon Aug 12 21:43:29 +0000 2024,1823113101824168235,Ταλαιπωρημένος Ανήρ,"@MarketElf Και όλη η Γροιλανδία καίγεται,τι άλλο να κάνει ο ηγέτης πια;",0,0,,,
Mon Aug 12 21:43:17 +0000 2024,1823113050981052897,sult1906,"ηρθε μηνυμα απο το 112 , πριν για Βρανά, τώρα για Μαραθώνα γενικά... το Μουσείο το προσέχει κανείς; #φωτιά",3,0,,,
Mon Aug 12 21:43:12 +0000 2024,1823113026788012038,newsbomb.gr,Φωτιά στην Αττική: Αναζωπύρωση στη «γραμμή» Γραμματικού - Μαραθώνα https://t.co/K3aMWPxQt8,0,0,,,
Mon Aug 12 21:42:53 +0000 2024,1823112949281464691,Ark Rules 🇱🇧,"@popokatifrydia @agamemnon_st Νιωώσε! Αυτοί που φταίνε είναι πάντα οι κυβερνώντες! Τα επιτελεία! Όσοι δεν προλαμβάνουν και δεν σχεδιάζουν τίποτε για το καλό του λαού.  Άλλο αρχιμαφιόζοι, άλλο τσιράκια.  Δεν έχει ατομική ευθύνη ο κόσμος που καίγεται.  Λες και είστε ΝΔ κάνετε με τις ατομικές ευθύνες. Αίσχος!",0,0,,,
Mon Aug 12 21:42:26 +0000 2024,1823112833707725113,errementari 🐺🌒🫎,#φωτια  Για την Αθήνα η ΝΔ σίγουρα έχει βάλει το χέρι της για συμφέροντα εργολάβων αλλά στη Θεσσαλονίκη όπως μαθαίνω ότι μπήκε φωτιά η αν συνεχίσει σε νησιά τότε μιλάμε για τουρκικό χέρι ( με την ΝΔ να σιωπά),1,0,,,
Mon Aug 12 21:42:14 +0000 2024,1823112784131010654,Πάνος Συνοδινός,"@Phantas89092442 Ποια ακριβως ψυχολογική πίεση? Διότι αλλη η πίεση ΤΗΝ ΩΡΑ που καίγεται το σπίτι σου, αλλη την ωρα που η φωτια ειναι πχ στα 3χλμ.",0,0,,,
Mon Aug 12 21:42:05 +0000 2024,1823112748974112941,Theo,@aggelos210 Η φωτιά πάντα καίει από πίσω για την καύτρα υπάρχει μια λύση τσάπα,0,0,,,
Mon Aug 12 21:42:01 +0000 2024,1823112732805333438,The_41_Percent_Sano_Dealer,@blackmore_r Ε αφού δεν είναι η πυροσβεστική επ αυτού φτου φτου φτου φτου φτου φτου φτου φτου!!!!!,1,0,,,
Mon Aug 12 21:41:49 +0000 2024,1823112681127391406,Nestor Grigoropoulos,@DimitrisSavvid4 Επειδή είστε εμμονικός με τον κ. @kyranakis από την εποχή που διαδίδατε fake news πως δήθεν δεν έχει υπηρετήσει στον ελληνικό στρατό ενώ επανειλλημένα σας είχε πει πως έχει και μετά τρεχάτε για δημόσιες συγγνώμες θα σας πω πω το συγκεκριμένο σύστημα σε δοκιμαστικό στάδιο και,161,26,,,
Mon Aug 12 21:41:28 +0000 2024,1823112593130570232,Εθιστήμων,Ε καλα τωρα μια φωτιά μπεικε που έκαψε λίγο #Βριλήσσια #Πεντέλη #Βαρνάβα. Ενω παράλληλα μας απαλαξε απο το βρωμερό δάσος. Και ανοιξε τοσο χώρο για επένδυση χρημα σε #ξενοδοχεία #αιολικα. Και έχετε πέσει να τον εφατε μωρέ τον σωτηρα μας τον #κουλη μας. Ποσο στραβαδια ποια,1,0,,,
Mon Aug 12 21:41:14 +0000 2024,1823112532443201790,ΜΑΣΤΟΡΑΚΟΥ ΑΝΝΑ,"MEDISPIN: Ερυθρός Σταυρός: Έκκληση για υγειονομικό υλικό και τρόφιμα, για τους πληγέντες από την φωτιά: https://t.co/1mbd3RMYMl",0,0,,,
Mon Aug 12 21:40:47 +0000 2024,1823112421281849431,Lore More,Ηλεία: Νυχτερινή φωτιά σε χορτολιβαδική έκταση στη θέση Δίχαλο της παλαιάς Μανωλάδας- Καίγονται ξερόχορτα και καλαμιώνες- Στο σημείο ισχυρή δύναμη της Πυροσβεστικής (Photos) https://t.co/saVeMKolax vía @Iliaweb.gr,0,0,,,
Mon Aug 12 21:40:41 +0000 2024,1823112395268436193,Complete unknown,"@egotis10 @RanakiG Δεν υπάρχει ασφαλιστική που να καλύπτει φωτιά σε τέτοια σπίτια, σε όσα ""σχέδια πόλεως"" και να ενταχθούν, όσες ""νομιμοποιήσεις"" κι αν τους κάνουν κάποιοι ...",2,0,,,
Mon Aug 12 21:40:25 +0000 2024,1823112326318318008,A͟͟͟͞͞͞p͟͟͟͞͞͞a͟͟͟͞͞͞t͟͟͟͞͞͞a͟͟͟͞͞͞ ☆🇵🇸,Το αέναο ασυνεχές της χαοτικής κηλίδωσης και η επιθετικότητα των κωνοφόρων στον περιαστικό και αστικό ιστό. Τόσο απλό  #φωτιά,7,3,,,
Mon Aug 12 21:40:23 +0000 2024,1823112318831546712,Stylianou maria,"Ανάμεσα στους πληγέντες της φωτιάς είναι και ο άνδρας που καταδικάστηκε για τη φωτιά στο Μάτι, η οποία στοίχισε τη ζωή σε 104 άτομα.  Θεία δίκη",0,1,,,
Mon Aug 12 21:40:05 +0000 2024,1823112242549719298,Άθεο Panda,@xrysa_katsarini Είναι καλά προετοιμασμένη η φωτιά.,4,0,,,
Mon Aug 12 21:39:56 +0000 2024,1823112207757918219,drafti,@omadaalithias Γι αυτό έφθασε η φωτιά στο Χαλάνδρι.......,1,0,,,
Mon Aug 12 21:39:45 +0000 2024,1823112162409083304,sc.kg.,@ClaireNem12 Καίγεται 24 μέρες το όρος ορβηλος .. κουβέντα .. στην   Εύβοια μέσα σε δύο βδομάδες πήραμε φωτιά τρεις φορές κουβέντα .. εκεί εσάς σας έχουν χεσμενους.. μόνο η Αθήνα και αυτό γτ δεν μπορούν να το κρύψουν,1,0,,,
Mon Aug 12 21:39:44 +0000 2024,1823112156218364359,Ανεπρόκοπος®,"Έλα παιδιά, μέχρι το Σεπτέμβρη θα τα έχετε ξεχάσει πάλι. #φωτια",13,1,,,
Mon Aug 12 21:39:44 +0000 2024,1823112155689803986,Πάνος Συνοδινός,Θα θέλατε σημερα στις φωτιες οι πυροσβεστες να ηταν 50%-50%αντρες γυναίκες? #φωτιά,21,0,,,
Mon Aug 12 21:39:42 +0000 2024,1823112147548746011,Flash.gr,Τεντόγλου και Καραλής για τη φωτιά: «Έξω από τα παράθυρα του αεροπλάνου σκοτείνιαζε η εικόνα» | Flash https://t.co/PIOS60P7cq https://t.co/doqcuqqpYw,0,0,,,
Mon Aug 12 21:39:38 +0000 2024,1823112131656446094,hoolicats.com,"...πώς να κοιμηθείς ενώ σε έχουν περικυκλώσει οι φλόγες🔥🔥🔥της κολάσεως, ξημερώνει Τρίτη και 13😱 με το ενδεχόμενο να βαράει το 112(13) σαν τον κούκο👀;;;#φωτια_πεντελη, #Μαραθωνα, #Πυρκαγια,#φωτια",4,2,,,
Mon Aug 12 21:39:25 +0000 2024,1823112077868691522,enikos.gr,"Φωτιά στην Αττική: Ήρωες με κουβάδες, κλαδιά και λάστιχα – Πολίτες παλεύουν με τις φλόγες – ΒΙΝΤΕΟ https://t.co/Mdm7rJhypL",4,2,,,
Mon Aug 12 21:39:20 +0000 2024,1823112054959755389,Thorin,@poetryf @taouktsis @DarkRaphael Έχει φτάσει η φωτιά στο Χαλάνδρι και στην Κηφισίας και ακόμη γλύφουν τα παπάρια του Κούλη! Ντράπηκε η ντροπή!,14,1,,,
Mon Aug 12 21:39:16 +0000 2024,1823112039931228442,enikos.gr,Φωτιά στην Αττική: Κάηκε το σπίτι του ανθρώπου που καταδικάστηκε για την πυρκαγιά στο Μάτι – ΒΙΝΤΕΟ https://t.co/TuZ9LGhceM,6,1,,,
Mon Aug 12 21:39:06 +0000 2024,1823111996658827601,Pan Pan,Παντού ακούμε για ανέμους αλλά η κιλοβατώρα είναι ακριβή γιατί ΔΕΝ φυσάει πολύ…. #φωτια,4,1,,,
Mon Aug 12 21:39:02 +0000 2024,1823111978421747995,Petros Harizaklis,"Φωτιά στη Δυτική Θεσσαλονίκη, εντός του πρώην Στρατοπέδου Καρατάσιου. Ευτυχώς ήρθε άμεσα η Πυροσβεστική. #φωτια #Φωτια_τωρα #Πολίχνη https://t.co/UL0CTqSOo5",9,1,,,
Mon Aug 12 21:38:51 +0000 2024,1823111935811792964,Rory's Moonchild,"Αν συνεχίσουμε να καίμε με αυτούς τους ρυθμούς τα δάση μας, το μόνο που θα μας μείνει στο τέλος θα είναι τα λιβάδια της Ποσειδωνίας, μόνο κ μόνο επειδή αυτά δε μπορούν να καούν   #φωτια #πυρκαγιά",9,0,,,
Mon Aug 12 21:38:40 +0000 2024,1823111886709072100,Το Διαφθορείο,"@silvestros_v 900000 στρέμματα κάηκαν πέρυσι στον Έβρο,20 μέρες έκαιγε η φωτιά ξεκίνησε από τον κεντρικό Έβρο και έφτασε να σβήσει στην Κομοτηνή, κοπριτες άριστοι σε αγαστη συνεργασία με κάθε λογής κολλητό εργολαβο",1,0,,,
Mon Aug 12 21:38:25 +0000 2024,1823111823694201052,Antwnia_c1,"#φωτια #σερρες #φωτια_πεντελη #πυρκαγια αφού και ένας γνωστός ... αυτός μωρέ..πως τον λένε ..ο πολύ γνωστός ..το 'πε ξεκάθαρα ""αφού μια μέρα θα καούν όλα"" τι σκάτε..στις Σέρρες 43 χρόνια δεν είχε ποτέ φωτιά, τώρα έχει 3 διαφορετικα μέτωπα,το ένα καίει αθόρυβα 26 μέρες..αυτά!",9,4,,,
Mon Aug 12 21:38:23 +0000 2024,1823111814714138884,Άναρχος,"""Ας καθαρίζατε τις αυλές σας να μην καιγόσαστε"" θα μπορούσε να πει σε ένα διάγγελμα, ο πρωθυπουργός μιας αφρικανικής χώρας που καίγεται η πρωτεύουσά της. Ο δικός μας μάλλον θα είναι πιο ήπιος. #φωτια",1,0,,,
Mon Aug 12 21:38:21 +0000 2024,1823111807109623853,Πάνος Συνοδινός,"Βλάκες γαλαζαιοι, αν οι ζαιοι βαζουν τις φωτιες, πιάστε τους.  Αν ειστε ανίκανοι να τους πιάσετε, πείτε το, αν και το ξερουμε ήδη.  Ειστε 5 χρονια κυβέρνηση και σας φταίνε μόνιμα οι αλλοι και τα σπάνια καιρικά φαινόμενα. Και 300 να κυβερνήσετε , παλι τα ίδια θα λέτε.  #φωτια",49,11,,,
Mon Aug 12 21:38:19 +0000 2024,1823111798272278849,ΤΟ ΠΟΝΤΙΚΙ,Φωτιά στην Αττική: Δραματική μάχη για να σωθεί η Μονή Πεντέλης – Video που κόβει την ανάσα https://t.co/2SOXQjuksL https://t.co/cUCSckaCKT,2,1,,,
Mon Aug 12 21:38:16 +0000 2024,1823111786788225352,πaλιόπaιδο ®,Μέσα στην πόλη της Θεσσαλονίκης φωτιά έτσι από το πουθενά(?) Το νου σας στο Σέιχ Σου ανίκανοι!!,11,3,,,
Mon Aug 12 21:38:13 +0000 2024,1823111774658527718,Stylianou maria,"Φωτιά στην Άνω Γλυφάδα: Δυο συλλήψεις για εμπρησμό.  Έτσι, μπράβο !",0,0,,,
Mon Aug 12 21:38:03 +0000 2024,1823111731532472645,13t,"@lovevoulis Δεν είναι αποστολή του στρατού αυτή  Για πάσα νόσο και πάσα μαλακια . Υπάρχει πυροσβεστική, δήμος Περιφέρεια, αστυνομία κτλ..",2,0,,,
Mon Aug 12 21:37:53 +0000 2024,1823111691485565133,The Unstable One,"Εκκενώνουν την περιοχή κοντά στο σπίτι μου, υπάρχει ανησυχία για την περιοχή μου, τουιταρω πόσο ανησυχητικό είναι ότι καίγεται ο αστικός ιστός  Εντωμεταξυ το επίπεδο των ψηφοφόρων της ΝΔ:",56,4,,,
Mon Aug 12 21:37:53 +0000 2024,1823111689815924830,μισελενάτος ζαχαροπλάστης,Το «επιθετική φωτιά» είναι πιο αστείο από το «πιο βαρύ και παχύ χιόνι» που έπεσε όταν έκλεισε η Αττική Οδός με χιλιάδες εγκλωβισμένους; Ψηφίστε ελεύθερα #πυρκαγια,2,2,,,
Mon Aug 12 21:37:45 +0000 2024,1823111657242902564,theFAQ.gr,"""Δίχως ενεργό μέτωπο η φωτιά στην Αττική"" έδωσε το σύνθημα από τις 11μμ ο μηχανισμός προπαγάνδας (65 δημοσιογράφοι της ΕΣΗΕΑ) του Μαξίμου,  ""Απομακρύνονται οι κάτοικοι από τον Βρανα Μαραθώνα προς τη λεωφ Μαραθώνος, ήχησε το 112"" δινουν τώρα oo.37' Mega/OPEN...",77,28,,,
Mon Aug 12 21:37:22 +0000 2024,1823111559725641742,Stylianou maria,Φωτιά στην Αττική: Δίχως ενεργό μέτωπο.  Επιτέλους,0,0,,,
Mon Aug 12 21:37:10 +0000 2024,1823111508668403963,Nikos Sarantakos,"@ngnmchaos @silvestros_v Εσείς τουλάχιστον  συζητάτε κόσμια,  μετανιώνω για το βιαστικό ψεκ. Δεν πήρα απάντηση όμως, πώς μεταφέρονται τα τεράααστια πτερύγια όταν δεν υπάρχει φωτιά. Δεν περιλαμβάνει διάνοιξη δρόμων η άδεια;",0,0,,,
Mon Aug 12 21:37:02 +0000 2024,1823111477999362318,CucuvaYia,"@SinodinosP Κάθε μέρα θες να τον βρίσεις,έκατσε  με την φωτιά!",1,0,,,
Mon Aug 12 21:37:00 +0000 2024,1823111469669536229,Petros Harizaklis,@ClaireNem12 Κλαιρη ευτυχως ήρθε άμεσα η Πυροσβεστική https://t.co/qg3jGGKNwS,4,0,,,
Mon Aug 12 21:36:46 +0000 2024,1823111410634641847,LEON_ALBA,"Πάτημα Βριλησσίων – Μαρτυρία πολίτη: “Τώρα που σβήσαμε τη φωτιά, ήρθε το πυροσβετικό” Αβοήθητος δήλωσε κάτοικος στο Πάτημα Βριλησσίων, που κατάφερε μόνος του, μαζί με γείτονες, να σώσει τα σπίτια της περιοχής του. https://t.co/ISFzS2ZxTT",0,0,,,
Mon Aug 12 21:36:22 +0000 2024,1823111307584836034,Διαλεκτικός Επεξεργαστής - Η Επιστροφή,"""Πάντα έπιανε #φωτιά"".  ""Κλιματική αλλαγή"". ""Φαινόμενο κηλίδωσης"".  ΟΧΙ.-   Η #πυρκαγια αντιμετωπίζεται ΚΥΡΙΑΡΧΑ με δραστικά μέτρα πρόληψης, πολιτική βούληση και σοβαρό σχεδιασμό.  Η κατάσβεση/καταστολή είναι ο έσχατος τρόπος αντιμετώπισης. https://t.co/DmSYKBtgvL",4,0,,,
Mon Aug 12 21:36:16 +0000 2024,1823111282750349319,panos andresakis,@Christinalirou2 @ZbejVty Εδώ στην πυρκαγιά του 2015 άφησαν τα πρόβατα στην στάνη να κάνουν ζωντανά για να πάρουν την αποζημίωση. Μέσα και τα σκυλιά. Υπάνθρωποι.,3,1,,,
Mon Aug 12 21:36:14 +0000 2024,1823111275087356206,Εσπερος,@cunnumalos Βρήκες αφορμή την πυρκαγιά να δείξεις άλλη μια  φορά ποσο προδότες και προσκυνημένοι είστε Ο σύλλογος της ελληνοτουρκικης φιλίας χρηματοδότουταν από ολες τις ελληνικές κυβερνήσεις μέλη εξ αυτών έχουν κουμπαριές με Τούρκους πολιτικούς,1,0,,,
Mon Aug 12 21:36:06 +0000 2024,1823111240979521657,Η ΑΝΑΠΟΔΗ,"@c0n_An Σα να τον ακούω να μιλά για την πυροσβεστική διάταξη που υποχρέωνε τους ιδιοκτήτες να λάβουν μέτρα πυροπροστασιας διαφορετικά θα είναι υπεύθυνοι αν καούν και θα τους επιβληθούν και πρόστιμα,και να γελάει ο άχρηστος!",1,0,,,
Mon Aug 12 21:35:10 +0000 2024,1823111007327395891,Εva Geo00,@ntalaoura Πως επιτρέπει η κυβέρνηση: 1)Να καίγεται η χώρα που εκπροσωπούν και υποτίθεται προστατεύουν την ασφάλεια της2)Αφήνουν να επεκταθεί η φωτιά που σημαίνει είτε ότι αδιαφορούν να τη σβήσουν είτε είναι ανίκανοι -αγνοουν ηθελημένα να το πραξουν,8,1,,,
Mon Aug 12 21:34:53 +0000 2024,1823110936317821387,ΤRiNiTy,"Μια απορια έχω,η Εκάλη γιατι δεν καιγεται ποτε?#Πεντελη #πυρκαγιά #Φωτια_τωρα",11,1,,,
Mon Aug 12 21:34:32 +0000 2024,1823110847603900818,typologos.com,Επείγουσα ανάγκη λήψης των κατάλληλων μέτρων  για  όλους τους βρισκόμενους ή εργαζόμενους  στις περιοχές που πλήττονται από τη φωτιά #Ειδήσεις #Ανακοινώσεις #εργαζόμενοι #Φωτιά #Αττική #πληροφορίες #Τυπολόγος https://t.co/p1ewOlQXgm,3,1,,,
Mon Aug 12 21:34:27 +0000 2024,1823110824946291172,Penny Rage,ΕΙΜΑΣΤΕ ΣΕ ΠΟΛΕΜΟ ΝΤΕ ΦΑΚΤΟ  #Φωτια στο στρατόπεδο #Καρατάσου στη δυτικη  #Θεσσαλονίκη. Δυνάμεις της #πυροσβεστικης  εχουν φτασει 6 #πυροσβεστικα και 28 #Πυροσβεστες  η φωτιά καίει πεύκο εντός του στρατοπέδου #Φωτια_τωρα #πυρκαγιά https://t.co/mAKneR9fey,50,10,,,
Mon Aug 12 21:34:25 +0000 2024,1823110817560113491,Zavic,"@LTasartir Εννοώ όπως άλλες φορές που είχαμε όλο συνεντεύξεις τύπου, διαγγέλματα. Επαρχία μένω αλλά θεωρώ πως είναι κάπως σοβαρό να καίγεται αστικός ιστός Ευρωπαϊκής πρωτεύουσας από φωτιά που ξεκίνησε 15χλμ μακριά … ξέρω γω, μπορεί να υπερβάλλω…",2,0,,,
Mon Aug 12 21:34:19 +0000 2024,1823110795003109408,Alex,Αφήνω αυτό εδώ. Τίποτα άλλο.  #φωτια #Κικιλιας #πυρκαγιά #Βαρνάβας #Χαλανδρι https://t.co/YeLLWe41u1,3,4,,,
Mon Aug 12 21:34:09 +0000 2024,1823110751839813913,Madata.GR,Κάηκε στην Πεντέλη το σπίτι του ανθρώπου που ξεκίνησε τη φωτιά στο Μάτι https://t.co/j5QbczN4cY #MadataGR #greeknews #eidiseis,1,0,,,
Mon Aug 12 21:34:05 +0000 2024,1823110735901122685,Jim Liavvas ⚕️,"@Konstan01214403 @3ellas Btw κάπως έτσι έφυγα κ εγώ τέλη Ιουνίου από τν δουλειά όταν υπήρξε φωτιά λίγα χιλιόμετρα πίσω από την δουλειά μ στην Κύπρο. Είμαι τυχερός δλδ που δν έβγαλαν κ γ μένα διαδικτυακό ""ένταλμα"" σύλληψης😅",1,0,,,
Mon Aug 12 21:33:59 +0000 2024,1823110707917005131,apostolos  domalis,"https://t.co/AUBzIjE4ne Η χλωρίδα δεν αλλάζει γιατί η Πυροσβεστική δεν προλαβαίνει. Αν το σύστημα δεν προλαβαίνει ή δεν μπορεί ή δεν θέλει να κατασβέσει φωτιές στα δάση, αλλάζεις το σύστημα.",0,0,,,
Mon Aug 12 21:33:37 +0000 2024,1823110616154087638,Μισάνθρωπος Φιλόζωος Βάρδος,"Θα έλπιζα αυτή η εικόνα να στοιχειώνει τον ύπνο του, όπως και όλες οι εικόνες της καταστροφής λόγω της ανικανότητας του, τα Τέμπη, η Εύβοια, η Δαδιά, η Θεσσαλία. Όμως το ξέρω ότι θα κοιμηθεί ήσυχος, γιατί έτσι είναι οι κοινωνιοπαθείς... #Μητσοτακης #πυρκαγιά #ΝΔ_θελατε https://t.co/RTXoR8kVQ1",0,0,,,
Mon Aug 12 21:33:31 +0000 2024,1823110590383919500,Spiros,@3ellas Στην πρώτη φώτο διακρίνεται ο καπνός από τη φωτιά πίσω από Αστεροσκοπείο. Από αυτόν τον καπνό φαίνεται ότι η φωτιά στο συγκεκριμένο μέρος έκαιγε πριν από αρκετή ώρα. Άρα η πυρκαγιά είχε αρχίσει πολύ νωρίτερα ή ήρθε από αλλού. Αυτός στη φώτο δεν είναι ο δράστης.,2,0,,,
Mon Aug 12 21:33:25 +0000 2024,1823110564845064429,pagenews.gr,Oλονύχτια θα είναι η μάχη των πυροσβεστικών δυνάμεων #φωτια #πυρκαγιά   https://t.co/ROojTLroEA,1,0,,,
Mon Aug 12 21:33:23 +0000 2024,1823110556464595280,BackstageNews,Ο Νίκος Συρίγος ξεσπά για την έλλειψη επίγειων κι εναέριων δυνάμεων για τη φωτιά στην Αττική #φωτια #SpoilerAlert #Spoilers #spoiler #survivorGR #GiTisElias #Magissa #timoros #AgiosErotas #DiafaniAgapi #kalageramata #grandhotel https://t.co/8Xa8JBpKYI,1,1,,,
