Date,Tweet_ID,Username,Raw Text,Likes,Retweets,is_fire,is_forest,is_urban
Mon Aug 12 19:54:32 +0000 2024,1823085680244756579,Homemade,Εθελοντές Ρουβίκωνα στην φωτιά.....δεν θα το δείτε πουθενά στα πετσωμενα https://t.co/RBwEff5p0t,1092,308,,,
Mon Aug 12 19:54:30 +0000 2024,1823085673458413928,𝗠𝗔𝗗𝗥𝗜𝗗,"Έλεος ρ μλκες εκεί στον ΣΚΑΙ....  Βλέπουμε την φωτιά όλη μέρα, βάλτε κάτι άλλο να ξεχαστεί ο κόσμος.  #poweroflovegr https://t.co/umB5FpNwhl",146,5,,,
Mon Aug 12 19:54:30 +0000 2024,1823085671692501500,twitty,"@KYTKYTKYTKYTKYT Η λύση είναι μία κι αυτή είναι η... (δικό σας). 'Οποιος γενετικά ηλίθιος πιστεύει ότι η απόλυτη τυραννία της μειοψηφίας θα πέσει με την... ψήφο, του αξίζει μόνο ψόφος. ""Φωτιά και τσεκούρι στους προσκυνημένους"". Καθίστε και κοιτάτε τους. Και μην ξεχνάς.Πληρωμή μόνο με κάρτα παντού",1,0,,,
Mon Aug 12 19:54:29 +0000 2024,1823085669410918499,Αιτωλομπανάνας,@PANOSPSL @georgefloridis 146. Ξέχασες τη φωτιά στα μπατζάκια σου.,1,0,,,
Mon Aug 12 19:54:22 +0000 2024,1823085639191114104,chrisold,@dstefanos Άσε τα κομματικά ρε βλάκα κ εσυ! Εδώ καίγεται ο τόπος και βρήκες να πεις εσυ για τον Πυρρο που τουλάχιστον πρόσφερε κάτι σε εμάς σαν λαό !χαμογελα ! Αν σε καεί τόσο πολύ να σχολιάσεις κάτι άνοιξε το παράθυρο σου κ δες τι γίνεται έξω ! Η μπορείς να δεις κ τον καθρέφτη σου!,3,0,,,
Mon Aug 12 19:54:05 +0000 2024,1823085569984889209,The President GR,Ολονύχτια μάχη με τις φλόγες στην Αττική #Αττική #πυρκαγιά   https://t.co/948ilZuEUg,0,0,,,
Mon Aug 12 19:53:56 +0000 2024,1823085529946054682,Candia Doc,"Ο Διαχειριστής βρίσκεται σε συνεχή επικοινωνία με την Πυροσβεστική Υπηρεσία για την κατάσβεση εστιών σε περιοχές όπου διέρχονται γραμμές μεταφοράς, προκειμένου να επανέλθουν το συντομότερο σε λειτουργία https://t.co/bewzAjJTDC",0,0,,,
Mon Aug 12 19:53:55 +0000 2024,1823085528499253334,Christos Roukos,"@Irinargbl Όταν έγραφα το τουητ έβλεπα κυρίως Άλφα και ΑΝΤ1. Εκεί δεν ειπώθηκε ποτέ τίποτα, ενώ αντιθέτως έλεγαν κάθε λίγο και λιγάκι ότι κοντεύει μια μέρα η φωτιά στην Αθήνα, με ολοένα πιο δραματικό τόνο 🤮🤮🤮",2,0,,,
Mon Aug 12 19:53:53 +0000 2024,1823085517086290316,🏴 BABIS XOURAFIS or Ά Π Α Τ Ρ Ι Σ 1312🏴,"Γαβ ,γαβ, τα μπλέ, πράσινα , ροζ , κόκκινα τσοπανόσκυλα , μπεεε και τα αντίστοιχων χρωμάτων πρόβατα. Εδώ έρχεται και κουμπώνει ακριβώς η παροιμία: ΕΔΏ Ο ΚΌΣΜΟΣ ΚΑΊΓΕΤΑΙ ΚΑΙ ΤΟ Μ...Ί ΧΤΈΝΙΖΕΤΑΙ!!!🏴🏴🏴",2,0,,,
Mon Aug 12 19:53:44 +0000 2024,1823085481309122564,Alejandro,@Lexotanil__ Περιμένω να δω ποιος είναι! Είναι του ΣΥΡΙΖΑ όπως λες η όχι; Γτ είστε κολλημένοι οι μεν κ οι δε .. όποτε ειναι κυβέρνηση ο ένας λέει η αντιπολίτευση έβαλε φωτιά ότι ναναι.. περιμένω να δω όπως λες ότι είναι ΣΥΡΙΖΑ αυτός,3,0,,,
Mon Aug 12 19:53:42 +0000 2024,1823085470626283978,Stelios The One,"@antixasia Ένα, θα σε βάζαμε μέσα και θα σε πετάγαμε στη φωτιά. Ο στόκος σβήνει τη φωτιά.",1,0,,,
Mon Aug 12 19:53:23 +0000 2024,1823085392473497962,Flashnews.gr,"🔥 #Φωτιά στην #Αττική: Στέλνουν βοήθεια Σερβία, Ρουμανία και #Τουρκία https://t.co/Jux5bxIiM6  #Flashnews",1,1,,,
Mon Aug 12 19:53:20 +0000 2024,1823085380918260095,I ksenitemeni,Στο ΠΑΛΑΙ Γαλατσιου ανάγκη για crates @DogsVoiceGR  #φωτια #πυρκαγιά #Βαρναβα #Πεντελη #Πατημα_Χαλανδριου https://t.co/7vHBIbrlMO,4,5,,,
Mon Aug 12 19:53:01 +0000 2024,1823085299989139786,GiorgioP74,"Ένα μεγάλο μπράβο στους ένστολους και όλους όσοι βοήθησαν να σβήσει η φωτιά. Ο συντονισμός απέδωσε αν και λόγω του ότι εχθές η εκδήλωση έγινε αργά, το βράδυ και οι άνεμοι της έδωσαν απίστευτες διαστάσεις. Σας είμαστε ευγνώμονες https://t.co/BBsI8ckTHN",1,0,,,
Mon Aug 12 19:53:01 +0000 2024,1823085298617884760,Αγάπη ❤️❤️,@iTeridona @AdonisGeorgiadi Ακριβώς αυτό είπα γέλια πράγματα από γελοίους ανθρώπους έχω έναν κόμπο καί μια μεγάλη στενοχώρια..... καίγεται ό κόσμος καί κανένα από τα σπίτια των πολιτών... Είμαστε άξιοι για αυτούς που νομίζαμε ότι θά μας προστατέψουν......,1,0,,,
Mon Aug 12 19:53:01 +0000 2024,1823085298487644191,Steiger st,"""Εντοπίστηκαν, τους κυνηγήσαν, έχουμε τα πλήρη στοιχεία τους και είναι θέμα χρόνου η σύλληψή τους», είπε ο δημαρχος Γλυφαδας κ.Παπανικολάου.  Φωτιά στην Τερψιθέα Γλυφάδας: Θέμα χρόνου η σύλληψη των δύο εμπρηστών λέει ο δήμαρχος https://t.co/QJep9XeQjj",24,10,,,
Mon Aug 12 19:53:00 +0000 2024,1823085296801521847,dimidimida,@MsLouellaDeVil Προφανώς αυτοί που άφησαν υποστελεχομένη την πυροσβεστική.,0,0,,,
Mon Aug 12 19:52:54 +0000 2024,1823085270801031347,dalli4,Μυρίζει για να καταλάβει από που έρχεται η φωτιά!,0,0,,,
Mon Aug 12 19:52:49 +0000 2024,1823085249376506143,ΣτονΣφυρίζω,Η Ακρόπολη τυλιγμένη στους καπνούς από τη μεγάλη φωτιά σε δημοσίευμα του CNNi - https://t.co/mhHYiLGihA,0,0,,,
Mon Aug 12 19:52:42 +0000 2024,1823085221530526205,ΜπανάναΤζο,MΗ ΤΣΟ ΤΑ ΚΑ ΡΟΣ!   Μονο! Αυτος σας αξιζει!   #πυρκαγια #πυρκαγιά #πυρκαγιές #φωτια,2,1,,,
Mon Aug 12 19:52:41 +0000 2024,1823085218091180039,Αραχώβης τρία.,@mpoumpivol2 @maouniaou Αυτό. Δεν είχαμε καμία πυρκαγιά που να αναφέρθηκε στις ειδήσεις ως κρίσιμη.,1,0,,,
Mon Aug 12 19:52:40 +0000 2024,1823085212655403055,L'argile,"@stinpizzamou Βάζει λίγο αέρα κ αντί να χαιρόμαστε που μπορεί να δροσίσει λίγο, φοβάσαι πού θα πιάσει φωτιά. Συνέχεια στον φόβο.",1,0,,,
Mon Aug 12 19:52:14 +0000 2024,1823085103284715949,Δήμητρα Κ.,Πιστεύετε στο  ΚΑΡΜΑ ??? Μόλις μάθαμε στις ειδήσεις ότι  Κάηκε το σπίτι εκείνου που ξεκίνησε η φωτιά το :'18  &amp; κάηκαν ζωντανοί  104  άνθρωποι ζώα περιουσίες κλπ  Συμβάλλοντας μ  επιτυχία κ η τότε Κυβέρνηση με την ασχετοσυνη της https://t.co/MZ0ja8Io6P,4,4,,,
Mon Aug 12 19:51:59 +0000 2024,1823085039392894994,Σ-0007 Septem,@yioults1 Μονο επανάληψη της μεγαλύτερης Εκκένωση μετά από αυτή της Δουνκέρκης και έδεσε το γλυκό,0,0,,,
Mon Aug 12 19:51:59 +0000 2024,1823085038952448243,ThePressProject,Έχουμε ο ένας τον άλλον. #φωτια #Πεντελη #Βαρβαβας #Βριλήσσια Πυρκαγιά στη ΒΑ Αττική  Aris Oikonomou/ SOOC https://t.co/bSDm2VIELm,47,16,,,
Mon Aug 12 19:51:56 +0000 2024,1823085028504727995,Brian ο Ναζωραίος 🇮🇲,"Η φωτιά καίει σπίτια και φωνάζουν, καλά να πάθουν οι δεξιοί, τι σκατόψυχοι μαλάκες είστε μωρέ",3,0,,,
Mon Aug 12 19:51:54 +0000 2024,1823085017557524595,Το ατίθασο καλαμάρι,"@lovevoulis Οι φαντάροι δεν είναι πυροσβέστες. Η φωτιά θέλει εξιδεικευμένο εξοπλισμό  Απλά αν θυμάστε ο αλήτης, 2 χρόνια πριν είχε βάλει την αστυνομία να σαπίσει στο ξύλο τους πυροσβέτες...",10,0,,,
Mon Aug 12 19:51:52 +0000 2024,1823085011702038714,Manos Naraslis,"@skasselakis τώρα που η χώρα  καίγεται, βυθίζεται στην φτώχεια και την εξαθλίωση,παρακολουθείτε από την ΕΥΠ, η δημόσια υγεία παρακμάζει και η δημόσια παιδεία βρικολακιαζει, καταλαβαίνεις γιατί πρέπει να φτιάξουμε ένα κοινό όραμα αξιοπρέπειας για την Ελλάδα και τους ανθρώπους της;",1,1,,,
Mon Aug 12 19:51:42 +0000 2024,1823084969759056088,Λευκός Ιππότης ☘️,"εχουμε φτασει στο αμην ,ξεκατινιαζομαστε στα σοσιαλ για την ιμαν, για τους ολυμπιακους, για τους γκευ, για τους λοατκι, για το κρεβατι του κασελ , για οτιδηποτε ασημαντο αλλα για τα σοβαρα, κουβεντα, ""δεν υπαρχει αλλος"", ε καλα να παθουμε τοτε #φωτια",4,1,,,
Mon Aug 12 19:51:41 +0000 2024,1823084963505332701,Νikos 1954,@MsLouellaDeVil ρε βλαμενο μενω στα α.πατησια και ακουω οτι η φωτια ειναι στο Χαλανδρι αυτο εχει κατεβει απο Πεντελη,1,0,,,
Mon Aug 12 19:51:40 +0000 2024,1823084959340634542,ΛΕΩΝΙΔΑΣ ΕΝ ΠΛΩ,@katerinaakribou ΘΑ ΠΡΕΠΕΙ ΠΡΩΤΙΣΤΟΣ ΝΑ ΓΝΩΡΙΖΕΙΣ ΤΟ ΠΟΣΟ ΣΗΜΑΝΤΙΚΟ ΕΙΝΑΙ ΤΟ ΠΟΙΟΣ ΚΡΑΤΑ ΤΗ ΣΗΜΑΙΑ Κ ΠΟΥ ΤΗ ΠΑΡΑΔΙΔΕΙ.ΠΑΜΕ ΠΑΛΙ.ΕΝΑ ΠΕΡΙΕΡΓΟ ΑΝΘΡΩΠΑΚΙ ΜΕΣΑ ΣΕ ΚΑΠΝΟΥΣ(η ΕΛΛΑΣ ΚΑΙΓΕΤΑΙ) ΠΑΡΑΔΙΔΕΙ ΤΗΝ ΕΛΛΗΝΙΚΗ ΣΗΜΑΙΑ ΣΤΟ ΧΑΡΟ Κ ΑΥΤΟΣ ΣΕ ΜΙΑ ΚΙΤΡΙΝΗ ΚΑΤΣΑΡΙΔΑ...ΕΙΣΑΙ ΠΟΛΥ ΨΗΛΑ ΠΗΔΑ,0,0,,,
Mon Aug 12 19:51:39 +0000 2024,1823084954714259457,𝐌𝐲𝐥𝐨 ⌚😏,Αριστερά Ουκρανία δεξιά η Αττική. Ελλάδα 2.0  2024 #φωτια https://t.co/1NDIMVEk3U,11,1,,,
Mon Aug 12 19:51:36 +0000 2024,1823084944651845787,"Μένουμε Ενεργοί - Ενημέρωση, Αγώνας, Αλληλεγγύη","ΜΟΝΟ Ο ΛΑΟΣ ΣΩΖΕΙ ΤΟΝ ΛΑΟ. Με την αλληλεγγύη του, με τους αγώνες του, για ζωή, υγεία, ελευθερία, αξιοπρέπεια. Δύναμη σε πυροσβέστες, εθελοντές. Βοηθάμε με κάθε τρόπο. Ενάντια στην πολιτική κυβέρνησης, κεφαλαίου. #antireport #Βριλήσσια #φωτια #πυρκαγιά #Αττική #Μάτι #Χαλανδρι https://t.co/6fRhSmxFlg",921,215,,,
Mon Aug 12 19:51:33 +0000 2024,1823084931787940079,Παπάρης Πρωκτοσάλτε ☮️,@MarketElf Γεια σου ρε Λάζο ! Καλά τα λες αφού καίγεται η υφήλιος εμείς γιατί να πάμε  πίσω .. ας κάψουμε την Αττική λοιπόν .. έχουμε ακόμα πολλές ανεμογεννήτριες στην αναμονή #φωτια,1,0,,,
Mon Aug 12 19:51:29 +0000 2024,1823084916336218176,enikos.gr,Φωτιά στην Αττική: Απόκοσμες εικόνες από τις καταστροφές που έχει αφήσει πίσω της η πύρινη λαίλαπα – ΦΩΤΟ https://t.co/7006VypZXd,4,2,,,
Mon Aug 12 19:51:29 +0000 2024,1823084914943897982,ΣτονΣφυρίζω,Ολικό μπάχαλο στην πυρκαγιά της Αττικής: Τεράστιες οι κυβερνητικές ευθύνες για τη φωτιά που καίει σχεδόν μέσα στην πόλη (Photos - Video) - Documento https://t.co/XWMHjzdnCQ,6,4,,,
Mon Aug 12 19:51:24 +0000 2024,1823084891333881994,Kalhas82,Το πυρηνικό εργοστάσιο υπάρχει ακόμα στα σχέδια; #φωτια,7,2,,,
Mon Aug 12 19:51:21 +0000 2024,1823084879908671788,Mhltiadou Artemis,"@crazy_cat_lados @pavpol2222 Κ εσείς σκοτώσατε 36χιλ απο τον κοβιτ,57 στα Τέμπη κ άλλους 87 στην πυρκαγιά της Ηλείας με τον...στρατηγό άνεμο, έχετε το θράσος να μιλάτε κ να κουνάτε κ το δάχτυλο ρε καθυστερημένα όντα της δεξιας,άντε κ στο διάολο καίγονται σπίτια,δάση,χιλιάδες ζώα, ηλίθιεέεεεεε",0,0,,,
Mon Aug 12 19:51:18 +0000 2024,1823084867317285008,enikos.gr,Φωτιά στην Αττική: Τραυματίστηκε πυροσβέστης – Μεταφέρεται στο νοσοκομείο https://t.co/McPhqQquq5,4,4,,,
Mon Aug 12 19:51:17 +0000 2024,1823084863660146838,K.Sav21,"Βαθρακογιάννης για φωτιές στην Αττική: Δεν έχουμε ενιαίο μέτωπο, αλλά πολλές ενεργές εστίες Οι εστίες εντοπίζονται στο όρος Πεντέλη και γύρω από τη Λίμνη του Μαραθώνα. #φωτια",6,3,,,
Mon Aug 12 19:51:14 +0000 2024,1823084850552737988,geogoulid,Το άχρηστοι είναι πολύ λίγο για τους κυβερνώντες. Η Ελλάδα πεθαίνει καίγεται πλημμυρίζει πτωχεύει χάνει εθνικό έδαφος. Διώξτε τους σήμερα!!!,3,3,,,
Mon Aug 12 19:51:14 +0000 2024,1823084849491857813,Emperor Supreme,@PrimeministerGR ΟΡΓΗ ΘΕΟΥ ΕΠΙ ΤΟΥΣ ΚΑΤΟΙΚΟΥΝΤΕΣ ΣΤΗΝ ΑΓΙΟΤΟΚΟ ΕΛΛΑΔΑ ΤΗΝ ΟΠΟΙΑ ΕΣΥ ΚΑΙ Ο ΣΥΡΦΕΤΟΣ ΜΟΛΥΝΕΤΕ.  Ο ΑΓ. ΠΑΪΣΙΟΣ ΕΛΕΓΕ ΌΤΙ ΦΩΤΙΑ ΜΕΣΑ ΣΤΟ 15ΓΟΥΣΤΟ ΕΙΝΑΙ ΣΚΑΜΠΙΛΙ ΑΠΟ ΤΗΝ ΠΑΝΑΓΙΑ. ΥΒΡΙΣΑΤΕ ΤΟ ΝΟΜΟΘΕΤΗ ΤΟΥ ΣΥΜΠΑΝΤΟΣ ΜΕ ΤΑ ΝΟΜΟΣΧΕΔΙΑ ΤΗΣ ΑΝΩΜΑΛΙΑΣ. ΚΑΤΑΡΑΜΕΝΟΙ. #φωτιες,1,0,,,
Mon Aug 12 19:51:03 +0000 2024,1823084807032902083,Eigengrau 🍉🍉🍉,Έχει πάρει φωτιά ο κωλος σας. Καιρός να αρχίσουν οι φάπες.,2,0,,,
Mon Aug 12 19:50:53 +0000 2024,1823084762832965995,Μπούμπης,"@pdiveris @maouniaou Βασικά είναι Fire and thermal anomalies, της NASA. Το θέμα είναι πως μπορεί να ήταν και μια φωτιά σε ένα χωράφι που καίγανε κλαριά όταν περνούσε ο δορυφόρος ξέρω γω. Πχ στην γειτονιά σου αν ζουμάρεις καλά θα δεις αυτό. https://t.co/CHTemhFNWJ",2,0,,,
Mon Aug 12 19:50:52 +0000 2024,1823084758479589386,xrixou,"@NIKSOTIROPOYLOS Αν φτάσει η φωτιά Συνταγμα,, θα μας ειδοποιήσετε?????χαχαχα😂😂😂",0,0,,,
Mon Aug 12 19:50:45 +0000 2024,1823084728213221743,KesyFZ,@saitanasker Εται οπως το λες ειναι λες καο μάθανε οι φωτιές από τα λάθη τους και γίνανε καλύτερες...  Στην πραγματικότητα απλά έχουμε καταστρέψει την πυροσβεστική..,10,0,,,
Mon Aug 12 19:50:44 +0000 2024,1823084725180719420,The Standard,Φωτιά στην Αττική: Ρεπόρτερ έσωσε σκύλο από την πύρινη κόλαση στη Νέα Πεντέλη (βίντεο) -  https://t.co/80Ojnyr8QL https://t.co/UsMLDOjUHY,0,0,,,
Mon Aug 12 19:50:31 +0000 2024,1823084670466105622,Θεία Λϊα,"το # φωτιά είναι για ενημέρωση όχι για να γράφει το κάθε κατακαϊμενο κομματικές προπαγάνδες,ρε πουστη μου δλδ ούτε στη πιο δύσκολη ώρα λίγη αλληλεγγύη κ ενσυναισθηση. μη γράψεις τίποτα το χριστο σου ή μη βάζεις χαςταγκ που αυτή τη στιγμή είναι ζωτικό να έχει ενημέρωσεις.",10,2,,,
Mon Aug 12 19:50:30 +0000 2024,1823084665613492667,hkem,Γιατί θα έρθουν όλοι αυτοί από το εξωτερικό για βοήθεια μιας και ηρέμησε η φωτιά; Έχετε σκοπό να κάψετε κάτι άλλο ;,0,0,,,
Mon Aug 12 19:50:29 +0000 2024,1823084662631117120,Ζάβαλος,"Πάντως η κυβέρνηση σας έχει προτείνει δολοφονία με τρένο, δολοφονία από πυρκαγιά δάσους σε Πάρνηθα, Πεντέλη, Εύβοια, Ροδόπη, δολοφονία από πνιγμό, δολοφονία από πανούκλα και όλα αυτά μέσα σε δυο χρόνια.  Γιατί είστε αχάριστοι;  #φωτια #φωτιες #Φωτια_τωρα #πυρκαγιά",57,21,,,
Mon Aug 12 19:50:29 +0000 2024,1823084661599244567,“ Εθνικό Ποντικάκι!” 𝓙𝓮𝓻𝓻𝔂,ΜΉΝΥΜΑ ΠΟΛΙΤΙΚΗΣ ΠΡΟΣΤΑΣΊΑΣ...  ΕΚΚΕΝΩΣΤΕ ΤΗ ΧΩΡΑ! ΓΙΑ ΤΗΝ ΑΚΡΙΒΕΙΑ ΕΚΚΕΝΩΣΤΕ ΤΟ ΠΛΑΝΗΤΗ!  #φωτιά #πυρκαγιά https://t.co/v4AlH96iT4,5,1,,,
Mon Aug 12 19:50:24 +0000 2024,1823084640766148910,newsbomb.gr,Φωτιά στην Αττική: Τραυματίστηκε πυροσβέστης – Μεταφέρεται στο νοσοκομείο https://t.co/HnJfNZZemY,0,0,,,
Mon Aug 12 19:50:14 +0000 2024,1823084598965756118,Τρίαινα,"Κεντρώα ανθρωπιά   Τον γαμας που τον γαμας τον στρατιώτη με πάρεργα   Πασοκ τους έστειλε με λιακάδα κέντρο Κηφισιάς καθάριζαν του παγους, οι μουνιτσες χαχαχα χουχουχου  Αυτοι καίγεται το πελεκουδι, καθάρισε χόρτα στην Πεντέλη, τίγκα στις γριές   Τομάρια 😂",8,1,,,
Mon Aug 12 19:50:14 +0000 2024,1823084598097494175,Petit_Bool,"@kostasp1488 @tomanifesto Πες μου ότι δε διάβασες το άρθρο χωρίς να μου το πείς είναι η φάση. Ο τίτλος άκυρος με το περιεχόμενο του. Ο κασελλακης δεν είπε τίποτα. Που να έλεγε ότι τον ενοχλεί η φωτιά που καίει τη χώρα μας. Θα τον έλεγες προδότη, ανθελληνα και ότι πρέπει να καίει το φως της Ελλάδας;",0,0,,,
Mon Aug 12 19:50:13 +0000 2024,1823084596860215722,gossip-tv.gr,"Φωτιά Αττική: Στην Αθήνα έφτασαν τα μέλη της ελληνικής Ολυμπιακής αποστολής , ανάμεσα στους οποίους o Μίλτος Τεντόγλου, και ο Εμμανουήλ Καραλής οι οποίοι δεν πίστευαν ό,τι συμβαίνει στην Αττική με τη φωτιά...   https://t.co/WN4u4Orsjt",0,0,,,
Mon Aug 12 19:49:58 +0000 2024,1823084532289175944,agries paparantzes,Α ωραία μια τάξη μια αλφαδιά όλα καλά κοιμηθείτε θα στείλει ..... για εκκένωση  #φωτια,2,0,,,
Mon Aug 12 19:49:51 +0000 2024,1823084502991638906,Τι ψηφίσατε ρε μαλάκες;,"Στη φωτιά να ρίχνουν να τους πείτε, μη μπερδευτούν και αρχίσουν και ρίχνουν στους πυροσβέστες. #Πυρκαγια https://t.co/O4DkXfqL4p",487,120,,,
Mon Aug 12 19:49:39 +0000 2024,1823084453268205687,Johnspike,"#φωτια #πυρκαγιά οι εμπρηστές να δίνονται για τιμωρία σε όσους κάηκαν Τα σπίτια , αυτοκίνητα , επιχειρήσεις η όσων κινδύνευσαν οι ζωες .",3,0,,,
Mon Aug 12 19:49:37 +0000 2024,1823084446394020152,Wednesday_141022🥷,@tas_dos @trebotroll Τάσο φύγε από τα rt μου ρε τσατσε που με κυνηγάς σαν την φωτιά τον μπάτσο,1,0,,,
Mon Aug 12 19:49:30 +0000 2024,1823084415058141566,Lingala🈳,"Ε ναι, γιατί φωτιά χωρίς αποθήκη πυρομαχικών, δεν είναι φωτιά",1,0,,,
Mon Aug 12 19:49:26 +0000 2024,1823084399564657010,Τσιρτσος Χριστοδουλος,Καθαρός εμπρησμος στο Βαρνάβα. Το λένε ίδιοι κάτικοι της περιοχής. Ειναι ντροπή η χώρα να καίγεται για πολιτικές.σκοπιμότητες #Ντροπή_ντροπή_ντροπή. #Μόνο τυχαία δεν ήταν η πυρκαγια. #Ντροπή_ντροπή!!!!,1,1,,,
Mon Aug 12 19:49:22 +0000 2024,1823084382393156076,Antiβλά,@ifastk Μάλλον γλίτωσε γιατί πέρασε η φωτιά από διπλανά οικόπεδα. Όμως η περιοχή από καταπράσινη έγινε κατάμαυρη.,1,0,,,
Mon Aug 12 19:49:10 +0000 2024,1823084331633725461,TheOpinion_News,Πολύ υψηλός κίνδυνος πυρκαγιάς και αύριο – Σε συναγερμό η πυροσβεστική https://t.co/Pcw405HS8g #Thessaloniki #skg #TheOpinion,0,2,,,
Mon Aug 12 19:49:08 +0000 2024,1823084320900133096,ΖΑΧΟΣ,@MsLouellaDeVil Ρε τομάρια καίγεται η Αττική κι σεις για να καλύψετε το ανύπαρκτο κράτος ασχολείστε με τους ζαιους? πραγματικά είστε μεγάλα σιχαματα,2,0,,,
Mon Aug 12 19:49:03 +0000 2024,1823084300205466020,Harry.k,"@volcaholic1 @yovanof #Στη Β. Ηπειρο καίγονται χωριά στους Αγ. Σαράντα, μετά τα χωριά της Δερόπολης, εδώ καίγεται η Αττική!!..",1,0,,,
Mon Aug 12 19:48:50 +0000 2024,1823084249034940509,TLIFE,Φωτιά στην Αττική: Συγκίνησε ο ρεπόρτερ του Star - Αποχώρησε από τις πυρκαγιές αγκαλιά με το τρομαγμένο σκυλάκι https://t.co/dghSJBMFmp https://t.co/Gxuayo1IDM,3,0,,,
Mon Aug 12 19:48:41 +0000 2024,1823084209453617506,Ρεσεψιονίστ σε απόγνωση,Ε τώρα πείτε μου ποιος ο λόγος να βλέπουμε 3 ώρες τη φωτιά; #PowerofLoveGR,30,1,,,
Mon Aug 12 19:48:34 +0000 2024,1823084181372440635,Eleni Xatzi,#Πυρκαγια #πεντελη #φωτιά Εννοείται ότι λυπάμαι για τις φωτιές αλλα ρε κοπρόσκ#λα εσείς οι μεγάλοι στείλτε κ Σέρρες τίποτα που καίγονται πόσες μέρες έλεος,7,1,,,
Mon Aug 12 19:48:32 +0000 2024,1823084171188707607,Katerina Kaboyra,@novelifinel Ας μου πει κάποιος λες και η φωτιά ξεχωρίζει πρωθυπουργους η κόμματα!! Ο αέρας μας κατάστρεψε!! Και εμείς ψάχνουμε το ποιος φταίει όχι ποιος έβαλε τη φωτιά🔥🔥🔥 ..έλεος!!,0,0,,,
Mon Aug 12 19:48:26 +0000 2024,1823084146668749014,satyros,Μήπως ξέρει κάποιος στην Νέα Πεντέλη στην περιοχή Άγιος Γεώργιος αν κάηκαν σπίτια; Κοντά στην οδο Στρατονίκης;  #πυρκαγιά #φωτια #Πεντελη #Νέα_Πεντέλη,0,0,,,
Mon Aug 12 19:48:25 +0000 2024,1823084143678472255,NorMaLe,"Ρε παιδιά, αυτή η ρεπόρτερ βρήκε σε live μετάδοση, πλαστά διαβατήρια και άλλα έγγραφα κι αντί να τα μαζέψει κ να τα παραδόσει στην αστυνομία συνέχισε το ρεπορτάζ για τη #φωτιά? Τι κάνει το @OpenNewsGr καλύπτει άτομα και καταστάσεις?  Η @hellenicpolice το είδε αυτό?",6,2,,,
